{
  "version": "0.1",
  "release_id": "release_run_e98307c958",
  "created_at_utc": "2026-04-22T09:48:21.249515Z",
  "kernel_version": "0.1",
  "artifacts": [
    {
      "path": "C:/Users/mateo/labtrust-portfolio/datasets/runs/p0_e4_matrix/raw/baseline/toy_lab_v0/centralized/seed_2/trace.json",
      "sha256": "e5971a7559e383422a90cffabbc3a13190b2fc0d74206b4fe0c42c1f570ac9c3"
    },
    {
      "path": "C:/Users/mateo/labtrust-portfolio/datasets/runs/p0_e4_matrix/raw/baseline/toy_lab_v0/centralized/seed_2/maestro_report.json",
      "sha256": "6b3341ab37d6bf9e487eb0f897fa0f4ec8f116feac75c0a303357344ab9c07d8"
    },
    {
      "path": "C:/Users/mateo/labtrust-portfolio/datasets/runs/p0_e4_matrix/raw/baseline/toy_lab_v0/centralized/seed_2/evidence_bundle.json",
      "sha256": "13541e9218fa72663cc9da6cb80549d068c5aff4780b4c015f3cf848bbd38485"
    }
  ]
}
