{
  "version": "0.1",
  "release_id": "release_run_f834ec87dd",
  "created_at_utc": "2026-04-20T05:56:21.741573Z",
  "kernel_version": "0.1",
  "artifacts": [
    {
      "path": "datasets/runs/meta_eval/scenario_lab_profile_v0/collapse_sweep/drop_0.25/seed_1/trace.json",
      "sha256": "76d00811a269576896aafd92bc63e939db801c95f710f3648395a6e3b8924054"
    },
    {
      "path": "datasets/runs/meta_eval/scenario_lab_profile_v0/collapse_sweep/drop_0.25/seed_1/maestro_report.json",
      "sha256": "a237f3b431f73c7ada35123096e6bcb39c44fbb8acc1c500fc7f1d016078b286"
    },
    {
      "path": "datasets/runs/meta_eval/scenario_lab_profile_v0/collapse_sweep/drop_0.25/seed_1/evidence_bundle.json",
      "sha256": "3192b8b26c0320a995cd7fb662a6e16383381d1b5104a8c33c2d72d21eecfd50"
    }
  ]
}
