{
  "version": "0.1",
  "release_id": "release_run_8cfbb8a63b",
  "created_at_utc": "2026-04-20T05:54:45.205389Z",
  "kernel_version": "0.1",
  "artifacts": [
    {
      "path": "datasets/runs/meta_eval/robustness_campaign/regime_stress_v1/sweep/collapse_sweep/drop_0.35/seed_19/trace.json",
      "sha256": "ffe5999fca8a472434ac5a8bd93a4aa90aaaa6a6de45ee1941b6be63129f3be3"
    },
    {
      "path": "datasets/runs/meta_eval/robustness_campaign/regime_stress_v1/sweep/collapse_sweep/drop_0.35/seed_19/maestro_report.json",
      "sha256": "9d9b92398f350e31313140a6d84e16705e2cf29436f52a8740becc7653393c15"
    },
    {
      "path": "datasets/runs/meta_eval/robustness_campaign/regime_stress_v1/sweep/collapse_sweep/drop_0.35/seed_19/evidence_bundle.json",
      "sha256": "3ccbd3c919510a2afa81f4772bd61c5bf6d2e386b7547cee1197018e76f32209"
    }
  ]
}
