{
  "version": "0.1",
  "release_id": "release_run_f34e2c0bbe",
  "created_at_utc": "2026-04-22T09:50:59.702509Z",
  "kernel_version": "0.1",
  "artifacts": [
    {
      "path": "C:/Users/mateo/labtrust-portfolio/datasets/runs/p0_e4_matrix/normalized/coordination_shock/toy_lab_v0/rep_cps/seed_16/trace.json",
      "sha256": "8395d9601d517bc2fb2e2e28207d08b921289b560190f1bb85c6b0bdf007464d"
    },
    {
      "path": "C:/Users/mateo/labtrust-portfolio/datasets/runs/p0_e4_matrix/normalized/coordination_shock/toy_lab_v0/rep_cps/seed_16/maestro_report.json",
      "sha256": "3fb462f35610f4be64075cfbc57cfb7c5dea8be5c51ea424192441857e4ee6cd"
    },
    {
      "path": "C:/Users/mateo/labtrust-portfolio/datasets/runs/p0_e4_matrix/normalized/coordination_shock/toy_lab_v0/rep_cps/seed_16/evidence_bundle.json",
      "sha256": "b1a4b530abaf608349d54d525c27358f74eee1df52ee13301866584abfa36a5a"
    }
  ]
}
