{
  "version": "0.1",
  "release_id": "release_run_551ee40d2d",
  "created_at_utc": "2026-04-22T11:15:54.184048Z",
  "kernel_version": "0.1",
  "artifacts": [
    {
      "path": "C:/Users/mateo/labtrust-portfolio/datasets/runs/p0_e4_matrix/normalized/stress/rep_cps_scheduling_v0/rep_cps/seed_6/trace.json",
      "sha256": "a330122e09496e3b52f297f62a5aab0a546a7941b65562d79a9c7631caf878af"
    },
    {
      "path": "C:/Users/mateo/labtrust-portfolio/datasets/runs/p0_e4_matrix/normalized/stress/rep_cps_scheduling_v0/rep_cps/seed_6/maestro_report.json",
      "sha256": "90380aee694fdbb87f57ccb17c493980dbadacc92b578e5f5d4b8a073b43f002"
    },
    {
      "path": "C:/Users/mateo/labtrust-portfolio/datasets/runs/p0_e4_matrix/normalized/stress/rep_cps_scheduling_v0/rep_cps/seed_6/evidence_bundle.json",
      "sha256": "23e302619ae29c811c484cec0dd5f8d4d63ca6b0d9cf0864e7bf0951d52299d2"
    }
  ]
}
