{
  "version": "0.1",
  "release_id": "release_run_2dce53a3ed",
  "created_at_utc": "2026-04-20T06:21:44.735937Z",
  "kernel_version": "0.1",
  "artifacts": [
    {
      "path": "datasets/runs/meta_eval/naive/seed_17/trace.json",
      "sha256": "4ba3504d299c1936d6895870c62d9528d600ec4105a11624a6ff0b96ddb87f4c"
    },
    {
      "path": "datasets/runs/meta_eval/naive/seed_17/maestro_report.json",
      "sha256": "3652ea3effe60d9e5013eb92add0bebeec4ad7641f5ec650fc8861d17b7a0ff3"
    },
    {
      "path": "datasets/runs/meta_eval/naive/seed_17/evidence_bundle.json",
      "sha256": "b94b55e51c89e9a800ec18bd577eec0575b2e62bcdcaa14dd8278ce06d39d7d4"
    }
  ]
}
