{
  "version": "0.1",
  "release_id": "release_run_4546c33b3f",
  "created_at_utc": "2026-04-22T09:49:53.998809Z",
  "kernel_version": "0.1",
  "artifacts": [
    {
      "path": "C:/Users/mateo/labtrust-portfolio/datasets/runs/p0_e4_matrix/normalized/moderate/rep_cps_scheduling_v0/rep_cps/seed_16/trace.json",
      "sha256": "1c3777ccfea0f73c2522cba3d3a4ce2db5f6eeaafb78f99323adc1b907be905b"
    },
    {
      "path": "C:/Users/mateo/labtrust-portfolio/datasets/runs/p0_e4_matrix/normalized/moderate/rep_cps_scheduling_v0/rep_cps/seed_16/maestro_report.json",
      "sha256": "fd6a67b492bb5941941379780980147ed5341aa2f70db636ecf2d206c4f8a697"
    },
    {
      "path": "C:/Users/mateo/labtrust-portfolio/datasets/runs/p0_e4_matrix/normalized/moderate/rep_cps_scheduling_v0/rep_cps/seed_16/evidence_bundle.json",
      "sha256": "189754e242cefd809fb398adcd83968770b37b0d1db3a03eba45de817d9f6852"
    }
  ]
}
