{
  "version": "0.1",
  "release_id": "release_run_b4dae373ed",
  "created_at_utc": "2026-04-22T09:50:05.790409Z",
  "kernel_version": "0.1",
  "artifacts": [
    {
      "path": "C:/Users/mateo/labtrust-portfolio/datasets/runs/p0_e4_matrix/raw/stress/toy_lab_v0/rep_cps/seed_5/trace.json",
      "sha256": "5cbccf4d71a34cb8759a37637b6636a490aed8adb656ba8c83a962a95766d683"
    },
    {
      "path": "C:/Users/mateo/labtrust-portfolio/datasets/runs/p0_e4_matrix/raw/stress/toy_lab_v0/rep_cps/seed_5/maestro_report.json",
      "sha256": "6ee4e657ae6c684946b115380b66067fac2039fa953434ba24de82e117d07fa9"
    },
    {
      "path": "C:/Users/mateo/labtrust-portfolio/datasets/runs/p0_e4_matrix/raw/stress/toy_lab_v0/rep_cps/seed_5/evidence_bundle.json",
      "sha256": "100e18941e510127967c6f1f1f74ff41cb77bd64cd4e932cf0953506d48c8979"
    }
  ]
}
