{
  "version": "0.1",
  "release_id": "release_run_6875c71198",
  "created_at_utc": "2026-04-20T05:51:56.895287Z",
  "kernel_version": "0.1",
  "artifacts": [
    {
      "path": "datasets/runs/meta_eval/scenario_regime_stress_v1/collapse_sweep/drop_0.35/seed_8/trace.json",
      "sha256": "211272141afcc38353ecb3e31c79e5cffaee6f5a3d17d32a3403abd74a70d442"
    },
    {
      "path": "datasets/runs/meta_eval/scenario_regime_stress_v1/collapse_sweep/drop_0.35/seed_8/maestro_report.json",
      "sha256": "501dfcbee0cda555400a2a3446e51d5a21d6dd85fda3ece5bbfc82d9a08fea5c"
    },
    {
      "path": "datasets/runs/meta_eval/scenario_regime_stress_v1/collapse_sweep/drop_0.35/seed_8/evidence_bundle.json",
      "sha256": "cd6a25bd1ffb9251bc428084ce3f764b306e319087d84575089b86d9de51da58"
    }
  ]
}
