{
  "version": "0.1",
  "release_id": "release_run_6ec43dfa59",
  "created_at_utc": "2026-04-23T11:34:09.829559Z",
  "kernel_version": "0.1",
  "artifacts": [
    {
      "path": "C:/Users/mateo/labtrust-portfolio/datasets/runs/p0_e4_matrix/raw/baseline/rep_cps_scheduling_v0/centralized/seed_13/trace.json",
      "sha256": "70f7e483baed50fbb8b64a7cd9884679c68ef36dc326be6d20de2031f2eabd5e"
    },
    {
      "path": "C:/Users/mateo/labtrust-portfolio/datasets/runs/p0_e4_matrix/raw/baseline/rep_cps_scheduling_v0/centralized/seed_13/maestro_report.json",
      "sha256": "7759d0f0a965ffed40e9799b0077ea44cf9d94dae17fed937c6f04ba70686485"
    },
    {
      "path": "C:/Users/mateo/labtrust-portfolio/datasets/runs/p0_e4_matrix/raw/baseline/rep_cps_scheduling_v0/centralized/seed_13/evidence_bundle.json",
      "sha256": "94dfa1941a29acb106e850bfebe3a32f490b7ee8d5711ab3c1c7b39241bc2486"
    }
  ]
}
