{
  "version": "0.1",
  "release_id": "release_run_26b61db84e",
  "created_at_utc": "2026-04-23T11:36:54.036242Z",
  "kernel_version": "0.1",
  "artifacts": [
    {
      "path": "C:/Users/mateo/labtrust-portfolio/datasets/runs/p0_e4_matrix/raw/coordination_shock/rep_cps_scheduling_v0/centralized/seed_13/trace.json",
      "sha256": "00b1c7c729d8cad0c6134ea1031eccd7939f07fdf63afde022c3fdcda55da639"
    },
    {
      "path": "C:/Users/mateo/labtrust-portfolio/datasets/runs/p0_e4_matrix/raw/coordination_shock/rep_cps_scheduling_v0/centralized/seed_13/maestro_report.json",
      "sha256": "84f9de803058b71fc469b2f064db91b1dbab957f02ff8ce18654281a9017a1d0"
    },
    {
      "path": "C:/Users/mateo/labtrust-portfolio/datasets/runs/p0_e4_matrix/raw/coordination_shock/rep_cps_scheduling_v0/centralized/seed_13/evidence_bundle.json",
      "sha256": "92dbf2714fdcd0df37e480b62f70ae5f7a9c1d78872bb7d9484b1fab8e235648"
    }
  ]
}
