{
  "version": "0.1",
  "release_id": "release_run_4005669c8a",
  "created_at_utc": "2026-04-20T06:29:01.606242Z",
  "kernel_version": "0.1",
  "artifacts": [
    {
      "path": "C:/Users/mateo/labtrust-portfolio/datasets/runs/meta_eval/robustness_campaign/regime_stress_v1/hysteresis_ablation/h1/fixed/seed_10/trace.json",
      "sha256": "0820e6df81a6fc28eb0e86d794890bc4f33f30586c06c3fcfccf52bc6bda646b"
    },
    {
      "path": "C:/Users/mateo/labtrust-portfolio/datasets/runs/meta_eval/robustness_campaign/regime_stress_v1/hysteresis_ablation/h1/fixed/seed_10/maestro_report.json",
      "sha256": "a7c28c4addd7e01115147e35c9b29b4b8de15ff384096dc4b8d34a22bede17a9"
    },
    {
      "path": "C:/Users/mateo/labtrust-portfolio/datasets/runs/meta_eval/robustness_campaign/regime_stress_v1/hysteresis_ablation/h1/fixed/seed_10/evidence_bundle.json",
      "sha256": "7163c3a7a9fdb051a5919f236a54071d07acec1dab2162b73dd1ff32fb7e0c58"
    }
  ]
}
