{
  "version": "0.1",
  "release_id": "release_run_804487dffe",
  "created_at_utc": "2026-04-22T09:50:14.025597Z",
  "kernel_version": "0.1",
  "artifacts": [
    {
      "path": "C:/Users/mateo/labtrust-portfolio/datasets/runs/p0_e4_matrix/normalized/stress/lab_profile_v0/centralized/seed_3/trace.json",
      "sha256": "b1c3acee08e9290b2e9febb9d49b66f3337da6bbac042d9de331465ad61f18d4"
    },
    {
      "path": "C:/Users/mateo/labtrust-portfolio/datasets/runs/p0_e4_matrix/normalized/stress/lab_profile_v0/centralized/seed_3/maestro_report.json",
      "sha256": "a704a7a00b60c06d068c04ee969dae74a6da4944dfb8854119c0b4529c4b5c9c"
    },
    {
      "path": "C:/Users/mateo/labtrust-portfolio/datasets/runs/p0_e4_matrix/normalized/stress/lab_profile_v0/centralized/seed_3/evidence_bundle.json",
      "sha256": "c0b04159a5e7d9691751cc6984d2dd43b59a74b9dbd32c3152bd8fa32cf57d8b"
    }
  ]
}
