{
  "version": "0.1",
  "release_id": "release_run_7d3341f89e",
  "created_at_utc": "2026-04-20T06:27:41.822193Z",
  "kernel_version": "0.1",
  "artifacts": [
    {
      "path": "C:/Users/mateo/labtrust-portfolio/datasets/runs/meta_eval/robustness_campaign/regime_stress_v0/hysteresis_ablation/h1/fixed/seed_16/trace.json",
      "sha256": "69d15ec72d32da70c4dc8796141397dae09cc349bd446297b95547c02b25debe"
    },
    {
      "path": "C:/Users/mateo/labtrust-portfolio/datasets/runs/meta_eval/robustness_campaign/regime_stress_v0/hysteresis_ablation/h1/fixed/seed_16/maestro_report.json",
      "sha256": "c251c566ef0662b113eb1342ed1a0b056517afbc2ead1a80d37607917df3974d"
    },
    {
      "path": "C:/Users/mateo/labtrust-portfolio/datasets/runs/meta_eval/robustness_campaign/regime_stress_v0/hysteresis_ablation/h1/fixed/seed_16/evidence_bundle.json",
      "sha256": "974c3bc03843a7f20f3b9a28adcaa789ef9a047d89cab5b177ba89d0b6f7e91b"
    }
  ]
}
