{
  "version": "0.1",
  "release_id": "release_run_81c56ff70d",
  "created_at_utc": "2026-04-20T06:27:22.907963Z",
  "kernel_version": "0.1",
  "artifacts": [
    {
      "path": "C:/Users/mateo/labtrust-portfolio/datasets/runs/meta_eval/robustness_campaign/regime_stress_v0/contention_sensitive/meta/seed_11/trace.json",
      "sha256": "7ff4ba8af26fc2ab528eb741b09b7f1bd28ba296201d54b6d3ea52520bd43e40"
    },
    {
      "path": "C:/Users/mateo/labtrust-portfolio/datasets/runs/meta_eval/robustness_campaign/regime_stress_v0/contention_sensitive/meta/seed_11/maestro_report.json",
      "sha256": "510209b12d113a5144c1d65045ea9bd94e93d3f46f3ab9835e1429e0c4ec7049"
    },
    {
      "path": "C:/Users/mateo/labtrust-portfolio/datasets/runs/meta_eval/robustness_campaign/regime_stress_v0/contention_sensitive/meta/seed_11/evidence_bundle.json",
      "sha256": "feb121cd56b96bd7b0022608d3243dde7e8058946f0574e19195fb64b9699a74"
    }
  ]
}
