{
  "version": "0.1",
  "release_id": "release_run_20575f0c75",
  "created_at_utc": "2026-04-23T11:34:54.732301Z",
  "kernel_version": "0.1",
  "artifacts": [
    {
      "path": "C:/Users/mateo/labtrust-portfolio/datasets/runs/p0_e4_matrix/raw/moderate/lab_profile_v0/rep_cps/seed_20/trace.json",
      "sha256": "c083a3f5ac8ed3223b10ea3a4bf78de8b0fbaaadfd184b068c45d6dd6ca7f629"
    },
    {
      "path": "C:/Users/mateo/labtrust-portfolio/datasets/runs/p0_e4_matrix/raw/moderate/lab_profile_v0/rep_cps/seed_20/maestro_report.json",
      "sha256": "17949f2bc2d688be6e97c2b5f8efccc1c469a355824bc053fb61f188863500bd"
    },
    {
      "path": "C:/Users/mateo/labtrust-portfolio/datasets/runs/p0_e4_matrix/raw/moderate/lab_profile_v0/rep_cps/seed_20/evidence_bundle.json",
      "sha256": "9fcae078fac53455fcd57821b6605615e1b98c5d0795acb1f5076c196b57fd9a"
    }
  ]
}
