{
  "version": "0.1",
  "release_id": "release_run_c65f52d544",
  "created_at_utc": "2026-04-20T06:29:20.147209Z",
  "kernel_version": "0.1",
  "artifacts": [
    {
      "path": "C:/Users/mateo/labtrust-portfolio/datasets/runs/meta_eval/robustness_campaign/regime_stress_v1/hysteresis_ablation/h3/meta/seed_19/fallback_run/trace.json",
      "sha256": "2a0ad193ba092b726b8ee2214a52570d85fed9e933cbac0e074ce1449134e18f"
    },
    {
      "path": "C:/Users/mateo/labtrust-portfolio/datasets/runs/meta_eval/robustness_campaign/regime_stress_v1/hysteresis_ablation/h3/meta/seed_19/fallback_run/maestro_report.json",
      "sha256": "9842ac91ce4e9cc22f7994f218e9e7b2662ec0c59ce9b7e8510cf62d09050291"
    },
    {
      "path": "C:/Users/mateo/labtrust-portfolio/datasets/runs/meta_eval/robustness_campaign/regime_stress_v1/hysteresis_ablation/h3/meta/seed_19/fallback_run/evidence_bundle.json",
      "sha256": "4e619004a1cd7e7e2729a465acebf00339582cb81b924a87595642ccd58d2e45"
    }
  ]
}
