{
  "version": "0.1",
  "release_id": "release_run_3dc09dc99b",
  "created_at_utc": "2026-04-22T11:15:52.243025Z",
  "kernel_version": "0.1",
  "artifacts": [
    {
      "path": "C:/Users/mateo/labtrust-portfolio/datasets/runs/p0_e4_matrix/raw/stress/rep_cps_scheduling_v0/rep_cps/seed_2/trace.json",
      "sha256": "dc6700943f782f64d93225c05fd879d01ae66510f473106464d2fe8ad7231a82"
    },
    {
      "path": "C:/Users/mateo/labtrust-portfolio/datasets/runs/p0_e4_matrix/raw/stress/rep_cps_scheduling_v0/rep_cps/seed_2/maestro_report.json",
      "sha256": "5acb3c2b7ce61ef8055b0d749e0ef6fd75e9ace1de49342aa6ad25b0a75ca137"
    },
    {
      "path": "C:/Users/mateo/labtrust-portfolio/datasets/runs/p0_e4_matrix/raw/stress/rep_cps_scheduling_v0/rep_cps/seed_2/evidence_bundle.json",
      "sha256": "aa02d32d954663afadec58d9fa9135f44b6a3665f53d0bfe08d36719a667346c"
    }
  ]
}
