{
  "version": "0.1",
  "release_id": "release_run_0880693ca4",
  "created_at_utc": "2026-04-20T05:54:11.422902Z",
  "kernel_version": "0.1",
  "artifacts": [
    {
      "path": "datasets/runs/meta_eval/robustness_campaign/regime_stress_v0/hysteresis_ablation/h1/meta/seed_17/trace.json",
      "sha256": "502bfe8f33b8122f48c1e6f832f7d06247b401fa93a81c180f24b556e36d64f4"
    },
    {
      "path": "datasets/runs/meta_eval/robustness_campaign/regime_stress_v0/hysteresis_ablation/h1/meta/seed_17/maestro_report.json",
      "sha256": "1c8d316b6c456d71e8e02983dfc275dd9496bfce3abf6226eca98836c5c15597"
    },
    {
      "path": "datasets/runs/meta_eval/robustness_campaign/regime_stress_v0/hysteresis_ablation/h1/meta/seed_17/evidence_bundle.json",
      "sha256": "7b3bdb2a059a2da7e8493294e9eea47481a44c9d9def43f26c83242c4aa0f2cd"
    }
  ]
}
