{
  "version": "0.1",
  "release_id": "release_run_5d2f69c967",
  "created_at_utc": "2026-04-22T11:15:20.838500Z",
  "kernel_version": "0.1",
  "artifacts": [
    {
      "path": "C:/Users/mateo/labtrust-portfolio/datasets/runs/p0_e4_matrix/raw/stress/toy_lab_v0/rep_cps/seed_13/trace.json",
      "sha256": "74e7b94803f3297fd20357cf948acaa0e0993a674687b481017778b22afe33ca"
    },
    {
      "path": "C:/Users/mateo/labtrust-portfolio/datasets/runs/p0_e4_matrix/raw/stress/toy_lab_v0/rep_cps/seed_13/maestro_report.json",
      "sha256": "240e99eec83ac20bd694dd580b898e57d12ac40c99e76dbe3d25e46fbf499525"
    },
    {
      "path": "C:/Users/mateo/labtrust-portfolio/datasets/runs/p0_e4_matrix/raw/stress/toy_lab_v0/rep_cps/seed_13/evidence_bundle.json",
      "sha256": "fabdae00b499c5e08f506e5e7f8a531e652973d77214304105719cb7b8c529f5"
    }
  ]
}
